{"version":"1.0","snapshot_id":"fact-p2-v1","product_id":"1072643655403","sku":"yb-bb-12","source_hash":"b284585bddd96f9eb38f97db43f7012837d2f6e86a17498834bf2324c485d1a8","source_record_id":"P2_fact_v1","approved_by":null,"approved_at":null,"effective_from":null,"effective_until":null,"status":"pending_confirmation","claims":[{"claim_id":"10-C01","claim":"长绒棉/100%新疆长绒棉（页面标题/参数）","status":"needs_evidence","evidence_status":"page_claim","allowed_wording":["页面标注“长绒棉”或“100%新疆长绒棉”"],"forbidden_wording":["未经材料证明的产地或纤维性能外推"],"evidence_ids":["10-C01"]},{"claim_id":"10-C02","claim":"纯棉100%/棉含量100%（页面参数）","status":"needs_evidence","evidence_status":"page_claim","allowed_wording":["页面参数标注“100%棉”"],"forbidden_wording":["第三方检测已证明"],"evidence_ids":["10-C02"]},{"claim_id":"10-C03","claim":"5s–10s吸水性等级（页面参数）","status":"needs_evidence","evidence_status":"page_claim","allowed_wording":["页面参数标注“5s–10s”"],"forbidden_wording":["实测一定5秒吸干、保证吸水速度"],"evidence_ids":["10-C03"]},{"claim_id":"10-C04","claim":"标准款（页面参数）","status":"needs_evidence","evidence_status":"page_claim","allowed_wording":["页面参数标注“标准款”"],"forbidden_wording":["比P1更薄、更差等比较结论"],"evidence_ids":["10-C04"]},{"claim_id":"10-C05","claim":"触肤即干/超强吸水（部分SKU选项文案）","status":"needs_evidence","evidence_status":"page_claim","allowed_wording":["仅在对应SKU选项画面中标注“页面文案”"],"forbidden_wording":["把SKU文案说成实验结果或保证"],"evidence_ids":["10-C05"]},{"claim_id":"10-C06","claim":"不掉毛（页面标题/评价摘录）","status":"needs_evidence","evidence_status":"page_claim","allowed_wording":["可引用为页面标题或评论摘录"],"forbidden_wording":["绝对不掉毛、永久不掉毛"],"evidence_ids":["10-C06"]}],"semantic_sha256":"8bb1d56430acd359de48cfac09e887821969c9a8357391b022753dea581f54fe","artifact_sha256":"262e9c3188f9e953e2770a5bf49d4aea5b91014a88b5e3aff1e83e74562dba9d"}