{"version":"1.0","snapshot_id":"fact-p1-v1","product_id":"1060430166297","sku":"yb-bb-03","source_hash":"a244fff012d7287c6afd1b2b084e5a9af0a7897e689782008b688927269e0164","source_record_id":"P1_fact_v1","approved_by":null,"approved_at":null,"effective_from":null,"effective_until":null,"status":"pending_confirmation","claims":[{"claim_id":"10-C01","claim":"银离子抗菌（页面标题/参数宣称）","status":"needs_evidence","evidence_status":"page_claim","allowed_wording":["页面标注“银离子抗菌”"],"forbidden_wording":["抗菌率、杀菌率、抑制病菌、医疗功效"],"evidence_ids":["10-C01"]},{"claim_id":"10-C02","claim":"纯棉100%/棉含量100%（页面参数）","status":"needs_evidence","evidence_status":"page_claim","allowed_wording":["页面参数标注“100%棉”"],"forbidden_wording":["第三方检测已证明"],"evidence_ids":["10-C02"]},{"claim_id":"10-C03","claim":"5s–10s吸水性等级（页面参数）","status":"needs_evidence","evidence_status":"page_claim","allowed_wording":["页面参数标注“5s–10s”"],"forbidden_wording":["实测一定5秒吸干、保证吸水速度"],"evidence_ids":["10-C03"]},{"claim_id":"10-C04","claim":"双面毛圈/抗菌处理（页面参数）","status":"needs_evidence","evidence_status":"page_claim","allowed_wording":["页面参数标注对应字段"],"forbidden_wording":["未经证据的性能保证"],"evidence_ids":["10-C04"]},{"claim_id":"10-C05","claim":"加厚款（页面参数）","status":"needs_evidence","evidence_status":"page_claim","allowed_wording":["页面参数标注“加厚款”"],"forbidden_wording":["比P2更厚、更暖等比较结论"],"evidence_ids":["10-C05"]},{"claim_id":"10-C06","claim":"不掉毛/防臭（页面标题宣称）","status":"needs_evidence","evidence_status":"page_claim","allowed_wording":["页面标题含“不掉毛”“防臭”"],"forbidden_wording":["绝对不掉毛、永久防臭"],"evidence_ids":["10-C06"]}],"semantic_sha256":"b2fac2baae43f461e0b5123f6ac0dd4118f83f5393dbcc9b8364c8913fe186ff","artifact_sha256":"fb432ac3344d99dcf9e2e2a078ca62c1e4fcb2cd6ac0971b1f59a62d471578ee"}